{
  "schema_version": "evidence-ledger-v1",
  "ledger_id": "fixture-oracle-valid-no-market-no-route",
  "workflow_id": "oracle-analysis-v1",
  "run_root": "dev/implementation/workflow-harness/fixtures/oracle-valid-no-market-no-route",
  "generated_at": "2026-06-06T00:00:00Z",
  "facts": [
    {
      "fact_id": "gearbox.market_or_credit_manager",
      "claim": "No Gearbox market or Credit Manager is found for the synthetic sample scope after the adapter-defined search.",
      "scope_id": "eth-mainnet-sample-base-token-gearbox",
      "stage_id": "S5_protocol_fit_and_parameter_context",
      "source_type": "negative_search",
      "retrieved_at": "2026-06-06T00:00:00Z",
      "method": "adapter bounded registry/API/contract search",
      "command_or_query": [
        "registry_checked: synthetic Gearbox market registry by asset 0x1111111111111111111111111111111111111111",
        "api_or_contract_query_attempted: market API fixture and factory/credit-manager lookup contract call",
        "network_context_named: Ethereum mainnet"
      ],
      "raw_output_path": "no-market-no-route-search-log.json",
      "decoded_value": null,
      "status": "investigated_no_result",
      "freshness": {
        "status": "point_in_time",
        "basis": "Fixture negative search is bound to the listed synthetic registry/API/contract transcript."
      },
      "decision_effect": {
        "effect": "requires_review",
        "rationale": "Adequate negative market evidence prevents a false unknown, but absence of a market is not Preview readiness.",
        "blocks_stage": false,
        "next_action": "Keep Propose=request_more_inputs unless a future adapter run finds a market."
      },
      "negative_investigation": {
        "search_space": {
          "scope": "Synthetic Gearbox market registry, API, and contract lookup surfaces for Ethereum mainnet.",
          "boundaries": [
            "fixture market registry",
            "fixture market API",
            "fixture factory/Credit Manager contract lookup"
          ],
          "exclusions": [
            "private integrations",
            "unpublished markets"
          ]
        },
        "queries_or_methods_tried": [
          {
            "method": "registry_lookup",
            "query": "asset=0x1111111111111111111111111111111111111111 chain=ethereum-mainnet",
            "result_count": 0
          },
          {
            "method": "http_api",
            "query": "GET /markets?asset=0x1111111111111111111111111111111111111111&chain=1",
            "result_count": 0
          },
          {
            "method": "contract_call",
            "query": "factory.creditManagers(0x1111111111111111111111111111111111111111)",
            "result_count": 0
          }
        ],
        "sources_checked": [
          {
            "source": "synthetic Gearbox market registry",
            "path": "raw/no-market-no-route-search-log.json#market_registry",
            "result": "no matching market or Credit Manager"
          },
          {
            "source": "synthetic market API",
            "path": "raw/no-market-no-route-search-log.json#market_api",
            "result": "empty markets array"
          },
          {
            "source": "synthetic factory contract query",
            "path": "raw/no-market-no-route-search-log.json#contract_lookup",
            "result": "zero address / empty result"
          }
        ],
        "sufficiency_assessment": {
          "verdict": "sufficient",
          "rationale": "Covers registry, API, contract, network, and raw evidence-path proof classes required by the Gearbox protocol adapter.",
          "known_gaps": [
            "Does not cover private/unpublished integrations."
          ]
        }
      }
    },
    {
      "fact_id": "gearbox.route_availability",
      "claim": "No execution or liquidation route is found for the synthetic sample scope after the adapter-defined search.",
      "scope_id": "eth-mainnet-sample-base-token-gearbox",
      "stage_id": "S5_protocol_fit_and_parameter_context",
      "source_type": "negative_search",
      "retrieved_at": "2026-06-06T00:01:00Z",
      "method": "adapter bounded route registry/API/contract search",
      "command_or_query": [
        "registry_checked: synthetic Gearbox route registry by asset 0x1111111111111111111111111111111111111111",
        "api_or_contract_query_attempted: route API fixture and router quote contract call",
        "network_context_named: Ethereum mainnet"
      ],
      "raw_output_path": "no-market-no-route-search-log.json",
      "decoded_value": null,
      "status": "investigated_no_result",
      "freshness": {
        "status": "point_in_time",
        "basis": "Fixture negative route search is bound to the listed synthetic registry/API/contract transcript."
      },
      "decision_effect": {
        "effect": "requires_review",
        "rationale": "Adequate negative route evidence prevents a false unknown, but absence of a route is not execution readiness.",
        "blocks_stage": false,
        "next_action": "Keep route unavailable for the fixture unless a future adapter run finds one."
      },
      "negative_investigation": {
        "search_space": {
          "scope": "Synthetic Gearbox route registry, quote API, and router contract lookup surfaces for Ethereum mainnet.",
          "boundaries": [
            "fixture route registry",
            "fixture quote API",
            "fixture router contract lookup"
          ],
          "exclusions": [
            "private RFQ channels",
            "unpublished routes"
          ]
        },
        "queries_or_methods_tried": [
          {
            "method": "registry_lookup",
            "query": "route asset=0x1111111111111111111111111111111111111111 chain=ethereum-mainnet",
            "result_count": 0
          },
          {
            "method": "http_api",
            "query": "GET /routes?asset=0x1111111111111111111111111111111111111111&chain=1",
            "result_count": 0
          },
          {
            "method": "contract_call",
            "query": "router.quote(0x1111111111111111111111111111111111111111)",
            "result_count": 0
          }
        ],
        "sources_checked": [
          {
            "source": "synthetic Gearbox route registry",
            "path": "raw/no-market-no-route-search-log.json#route_registry",
            "result": "no matching route"
          },
          {
            "source": "synthetic quote API",
            "path": "raw/no-market-no-route-search-log.json#route_api",
            "result": "empty routes array"
          },
          {
            "source": "synthetic router contract query",
            "path": "raw/no-market-no-route-search-log.json#router_lookup",
            "result": "quote unavailable"
          }
        ],
        "sufficiency_assessment": {
          "verdict": "sufficient",
          "rationale": "Covers registry, API, contract, network, and raw evidence-path proof classes required by the Gearbox protocol adapter.",
          "known_gaps": [
            "Does not cover private RFQ or unpublished routes."
          ]
        }
      }
    }
  ]
}
